id,parent_id,comms_num,body,sentiment
crs11rp,t1_crs0cei,208,"if you read my previous comments, you'll see that i acknowledge that sexism is for sure *part* of the problem op is experiencing - i'm just saying that it is not **the explanation** for the problem because men go through the same thing when dealing with other men.  i'm a software developer and i'm latino (not spanish though) and sure that bit me in the ass sometimes, specially since i have a bit of an accent. it's not a perfect world and it will never be, but i don't try to blame my race for my shortcomings even if it does, in fact, play a part against me. i just know from experience that once i show i can do what needs to be done, consistently, these little shenanigans go away.",positive
crs3ld6,t1_crs0cei,208,there is obviously bias for everything. people's perceptions are different depending on the color shirt you wear.   the strength of bias is what is unknown and should be debated.,negative
crrog5l,t1_crrmsy7,208,you got downvoted for telling the truth. classy subreddit,negative
crrvegz,t1_crrufvh,208,[:)](http://imgur.com/gallery/pmnff),positive
crrv1xz,t1_crrur7f,208,"i wonder if you're one of those guys who's threatened by competent women.  i've seen plenty of them, both in it and in the kickboxing gym i go to.",negative
crruwcr,t1_crrur7f,208,"i'm a guy  you're not only an example of the kind of impolite i'm talking about, but you're an asshole as well  wanna try again?",negative
crrvd6u,t1_crrur7f,208,[:)](http://imgur.com/gallery/pmnff),positive
crrwiji,t1_crrur7f,208,[:)](http://imgur.com/gallery/pmnff),positive
crs94i3,t1_crs8hss,208,"i'm entirely open to the idea that what the op is talking about isn't a result of sexism, at least not entirely, but there's a strong difference between asking ""why do you feel like matt is being picked because of his gender?"" and saying from essentially an infinite distance away ""nope, you're wrong, not sexism.""   you provided a nuanced, intelligent response that asked some questions on the topic in an effort to clarify the situation. most of the people who question the op's conclusion that these issues are gender-based simply dismissed the op as wrong without seeking any more detail. they simply assumed that their lived experiences are more valid than the op's and jumped right to ""what you're saying can't be right"". that's what's so exhausting about this whole conversation.",negative
crs3xm8,t1_crs3epx,208,"it's literally nothing like that, because in this case the ""doctor"" is random people on the internet who've never met this person and have no idea how their life is actually going.",negative
crrr306,t1_crrplup,208,so better to let the the assholes run free?,negative
crrr48a,t1_crrodrl,208,"better to risk my job than be walked all over.   i see calling people on their shit as a social obligation.   this is probably the reason i don't have tons of friends, though i can actually count on the friends i do have.",positive
crry37c,t1_crrw874,208,"it's not so much about talking. it's about listening.   i also subscribe to /r/askmenover30 and /r/redditforgrownups though i am under 30, and have listened to the latino usa podcast many times (and studied spanish), and viewed youtube videos and articles about black people's lives in the us though i am white. as i said, there is value in understanding life from perspectives different from my own.  it's one of the many reasons why the internet is one of mankind's greatest inventions. if we let it, it helps us go beyond ourselves and connect with others.   that's all i'll say on this.",positive
crseqjg,t1_crs20q4,208,"wow, i had no idea companies still operated like this.  this thread is really giving me some perspective.",positive
crs5s92,t1_crs3stw,208,"if you are looking for men to understand the ""situation"", then the debate about whether the industry is actually not welcoming to women or not should be opened.",negative
crrvpnt,t1_crrrc2z,208,"yeah. it doesn't mean your flawed, but there is something blocking you from operating from a place of strength, setting boundaries so that people don't feel comfortable treating you that way. personal work, possibly with the help of a therapist, can help you see what this is so that you can be without it",negative
crs2pqq,t1_crs1lsz,208,"the problem is that op read about those stories before her experience. it's actually better to call her ""experiences"" perceptions instead. these perceptions of her actual experiences are easily influenced by what other people say. it's like watching a scary movie before going to bed and then having a scary nightmare. it's a self fulfilling prophecy.  this trend tells more about how men and women deal with problems. all the guys in this thread have experienced the same problem but none of them chose to complain about it or blame it on sexism/racism.",negative
crthxsj,t1_crs1lsz,208,"your last sentence doesn't sit right with me. there is no ""truth"" about how women are treated in the tech industry. i know plenty of women who would 100% agree with me and absolutely despise the whole ""tech is full of misogyny"" trend as of late. all it does is make women less likely to pursue that field of work. and there is no real evidence to back the claim up. well the evidence i always here is the fact that there are fewer women in tech then men. seems like some sort of self-fulfilling prophecy..  also you mention that for men it is always a non-gender aspect. how do you know that? i know for a fact that all those things still happen to people *with* formal education. what evidence is there that it is a gender related issue for women, and some totally different issue for men? on that note if you are right why is it that men face the same problems, but just because it is not gender related it doesn't matter?",negative
crs3nrk,t1_crrzhhi,208,"that has nothing to do with my point, and i had to literally search the comment chain above for the phrase ""order of magnitude"" to even see what you were going off on me about.  now that i've found it, it seems that you're fixating on the wrong thing.  my point was that people generally don't react well to other people ""correcting"" them publicly at work, or pointing out how much faster they can do something.  thus you have to be really careful when correcting someone or showing off, that you do it in a way that allows the other person to save face and feel like their self-esteem and livelihood are not at risk.  this has nothing to do with gender or the software profession, it's more of a human nature type of thing.",negative
crs0b20,t1_crrzxuj,208,"this assumes that the hiring team is incompetent and regularly hires people who aren't capable of performing the job they were hired for  hiring in general in this industry is completely broken. there is no good foolproof way to hire people for the incredibly complex kinds of skillsets we deal with.   but to me they involve actually working on the code base.   on things that aren't priority tickets. did you miss that part of op's post, which i've repeated twice now? go read it again.   you don't have to shift everyone's work around  please explain to me how you get other people to cover the work new hire was supposed to be doing but couldn't without shifting everyone's work around.    team succeeds or fails as a team  yes but what you completely, entirely miss is that teams are made up of individuals. and to meet team goals, the individuals within the team need to be assigned portions of the work to do. divide and conquer.   helping a new person learn the code base is not a waste by any stretch of the imagination.  you're shifting goalposts. helping a new person isn't a waste.  giving a new person a priority ticket as work to do and then needing to backstep on that assignment *is* a waste.   hence why any competent team will give new hires small tasks to do while they learn the codebase and ask questions, *then* ease them into larger contributions.   you figure out that the person you hired was decent, and they're working at integrating with their new team by asking good questions and figuring out how things work on the ground level, instead of feeling like nobody trusts them to do decent work  even if we make this assumption you've just admitted that there is work to do in integrating the person with the new team and investigating the ground level. i.e., *you don't give the new hire priority features to work on, because they are new*.   i get that you're really interested in playing the social justice game, but this is not a social justice issue, it is a management issue.",negative
crry4fb,t1_crry0yo,208,if it's a year that's definitely a different conversation. i was just replying to the initial assumption part.,positive
crs6vl2,t1_crs11rp,208,"fair enough - sorry, i misread you there.",positive
crrlxhf,t1_crrl5hs,208,"my thinking is that if they pass you by for someone who is not particularly experienced, then it's important to assert yourself and assure them that you can of course handle the problem, while using words of confidence (absolutely, definitely, certainly, etc).   confidence begets respect. also, if the more critical jobs typically pass you by, then the first few you get will be good ammo for later when you say ""don't bother john, of course i can take care of this. feature xx rolled out smoothly on its sorry timeline, right?""   similarly, push it back on them (this doesn't require previous jobs as ammo) . they might be dicks, but i doubt they'd want to have to see themselves being dicks.  using the previous lines ""don't bother john, of course i can take care of this. you've always trusted me to do great work, steve,  i appreciate that. "" it makes it harder for them to back out as you've just highlighted this wonderful (albeit bullshit)  quality of theirs.   disclaimer: i haven't tried these in a team scenario but they draw from dealing with clients and spending a lot of time learning how to deal with people. i'm just getting to the point where i'm close to being ready to jump into a career in programming.    **highly** recommend ""how to win friends and influence people"" by dale carnegie.  it will simultaneously make you more understanding and more effective.    ... or just find the biggest sob in the room and knock him out. i saw it in a movie once,  so it must work.",positive
crrq48s,t1_crrog5l,208,he's getting downvoted for a false equivalency. just because people treated him poorly does not mean that op was not experiencing sexism.,negative
crs3oxw,t1_crrog5l,208,"i think there is some sort of brigade by feminists in this sub. every time a gender related topic comes up, the down votes don't correlate with the number of responses with personal experiences from the industry",negative
crs9ex7,t1_crs94i3,208,"yeah i definitely feel like this is a situation that calls for a ""happy medium"" approach to discussion. from op's post, i don't personally see enough evidence to leap to the conclusion that the company, team, or even any specific individual is genuinely acting out of sexist motivation. however, it's even more ridiculous to assert (as some people itt are doing) that there's no way there's any sexism going on. it's entirely possible that there is, even though i don't personally think we've seen enough evidence to completely call it such just from this one post.",negative
crs4ied,t1_crs3xm8,208,"that doesn't change anything. op is looking for advice from "" random people on the internet"" and the same protocol can be used.",negative
crrstyt,t1_crrr306,208,"it's like the saying ""don't wrestle with pigs. you'll get dirty and the pig likes it"".  i had a guy wait five years to get revenge because i wounded his ego by showing him up in public.   fighting these people directly doesn't change their behavior. what i've seen work is just not getting drawn into their bullshit and modelling better behavior.",negative
crrr9y8,t1_crrr306,208,"sometimes it's better to just give them the rope, they'll hang themselves soon enough.",negative
crrwshq,t1_crrr48a,208,"calling people on their shit as a social obligation  and every person your calling out, is probably feeling like your an asshole and would love to call you out (and i'm sure some try to)",negative
cs94ka8,t1_crseqjg,208,"you mean, people operate like this. companies don't have beliefs and opinions.",negative
crsb5hw,t1_crs5s92,208,so do you believe the tech industry is equally welcoming to women as it is to men? just trying to understand the debate.,positive
crs2yyu,t1_crs2pqq,208,"this is where we start to disagree thoroughly. if you think it's as easy to be a woman in tech as it is to be a man, and that what you look like as a person has no bearing on how people treat you or what game you're playing, you're just plain wrong. in life, whether you're fat or skinny, attractive or unattractive, black or asian or chicana or white etc. all changes how people treat you even if it's not in terms of overt discrimination. in some cases, you can do something about it, and in others you can't.   i suspect many women wish they could will away the way they are treated, say it's just all in their head. but it's not. i've seen it happen firsthand, i've seen sexual harassment, i've seen their identity brought up repeatedly for them without them doing it actively or wanting it brought up. it's the ""oh wow, you're a girl and you're in this space"" mentality and it and its logical consequences are *pervasive*. i strongly feel that the only way someone could feel like it's in their heads and that they're psychologically primed to think this way is if they genuinely haven't put themselves in a woman's shoes, not *really*.  and not all guys have experienced the same problem, not in the same way. i have seen guys complain about this sort of stuff when they're self-educated, and they rightfully bring up that they think it's because of their background. no one gives them shit for coming to those conclusions, and good advice is offered.",negative
crtph7q,t1_crthxsj,208,"your last sentence doesn't sit right with me. there is no ""truth"" about how women are treated in the tech industry. i know plenty of women who would 100% agree with me and absolutely despise the whole ""tech is full of misogyny"" trend as of late. all it does is make women less likely to pursue that field of work. and there is no real evidence to back the claim up. well the evidence i always here is the fact that there are fewer women in tech then men. seems like some sort of self-fulfilling prophecy..  what's more likely, that women are not entering the highly lucrative field of computing because they are structurally disincentivized and disadvantaged from doing so, or because they ""heard"" that that there's some kind of vague ""misogyny"" that men in the industry deny even exists? isn't it much more likely that the reasons women don't enter technology are varied and contextual but still fundamentally systematic?  the fact of the matter is, tech is extremely lucrative, men are not inherently better at it, yet we see the number of women at a dramatic low. girls and young women are culturally discouraged from joining engineering in part because of the cultural perceptions surrounding engineering and stem, and this has shaped engineering itself to some extent.  do i think men on the whole are consciously treating women badly? no. do i think women in the tech workplace are treated differently from men? absolutely, yes. 95 percent of the time it's very subtle, but it's there. people make jokes about women ""all in good fun"" but it's extremely one-sided and constantly reminds women that they don't belong. it's not the end of the world for them but it's alienating, and over time it can make a job a lot less friendly for someone than if they were a man.  on that note if you are right why is it that men face the same problems, but just because it is not gender related it doesn't matter?  this probably does happen to men, and it probably is an issue when it happens and should be addressed. but it doesn't happen to nearly as many men in the way that it likely happens to *so many* women simply because they're women. if you don't think a tech workplace looks different in a different body, i seriously doubt you've had many in-depth conversations with women who have faced these issues.   what doesn't make sense to me is: why be resistant to the *possibility* that women are treated differently and that people do treat women differently on account of their identity? is it because you'd never personally do it and you don't believe your co-workers would either? if you say yes, i'd actually believe you. but as someone who used to occasionally make jokes and comments that were probably a little bit sexist, i will say that it is so difficult to know whether what you're saying is alienating someone and making their day a little worse especially when it's socially acceptable to say certain mildly sexist things or act in certain ways.  edit: this is a great account of someone's experiences on this thread. http://www.reddit.com/r/cscareerquestions/comments/381e1k/female_se_getting_really_frustrated_at_work_some/crsfeq2",negative
crs44qx,t1_crs3nrk,208,"this has nothing to do with gender or the software profession  [actually, women in tech are much more likely to receive negative feedback and for that feedback to be stronger than their male counterparts.](http://fortune.com/2014/08/26/performance-review-gender-bias/)  the money quote:    this kind of negative personality criticism_watch your tone! step back! stop being so judgmental!_shows up twice in the 83 critical reviews received by men. it shows up in 71 of the 94 critical reviews received by women.",negative
crs0w2g,t1_crs0b20,208,"there is no good foolproof way to hire people for the incredibly complex kinds of skillsets we deal with  right. so economically, you should prioritize identifying bad hires quickly (in much the same way you prioritize failing quickly with the code you write). you can't do that if you're giving them little unimportant tasks.   on things that aren't priority tickets.  everything is a priority ticket. i don't know what your workflow looks like, but on my team, we only work on the highest priority stuff. pulling things out that are low priority just for a new person to work on is going to actively give the impression that they're not trusted as a developer. sure, if you've got someone who's never used git before, you might pull out a bug in the login form or something, but the purpose there is to teach them git, not ""get them acquainted with the code base"".    giving a new person a priority ticket as work to do and then needing to backstep on that assignment is a waste.  you're going to have to help that person with questions and code reviews no matter what they work on, so it makes sense to allow that thing to be impactful so that (a) they're able to see their own contributions and (b) they're able to be broadly exposed to the code base as soon as possible.   hence why any competent team will give new hires small tasks to do while they learn the codebase and ask questions, then ease them into larger contributions.  as someone who manages a software team, i've had nothing but wild success giving people bigger tasks than they're expecting or think they're ready for early on in their employment. when i check in with them after they get it merged to master, the response is universally ""i didn't think i was ready for that, but there was lots of support and it turns out i'm farther along than i thought i was"". i don't do this on the first day, but it's usually within the first week. it helps us identify their strengths and weaknesses and build on that success going forward.   i get that you're really interested in playing the social justice game, but this is not a social justice issue, it is a management issue.  there's no difference between those things. treating people well is a core part of good management.",positive
crrydz9,t1_crry4fb,208,i agree.  and then there's the fact that you are only considered as good as your last major screw up  there's really nothing you can do about that,positive
crs1cgi,t1_crrlxhf,208,"win rings  win *friends*, no?",negative
crs63e4,t1_crrq48s,208,he brought up a different perspective which is useful for op to have a more rounded perspective.,negative
crrwumq,t1_crrwlav,208,"intimidation is what earns your respect? i would rather live in a world where someone respects me without having to bully them. neat kink, but maybe you should leave your gender power dynamics in the bedroom and just treat people like people?",negative
crrx49n,t1_crrwlav,208,"is the op taking shit from people or is she asking ""is this what this looks like to all of you?"" because she is unsure?  the op's gonna have to weigh in on that.  i assumed she was asking.  i also assumed she was smart enough to realize that 6 weeks into a job its possible for people not to have confidence in your skills but 6 months is more than enough time to prove yourself.",negative
crrvdro,t1_crrv9xi,208,[:)](http://imgur.com/gallery/pmnff),positive
crrvfsd,t1_crrv9xi,208,"lol  hey, be careful backpedaling so fast, you might bump into something and hurt yourself  and if you can't see the difference between common courtesy and bending over backwards then you didn't pay attention in kindergarten and since i'm not your father i'm not going bother correcting you",negative
crs4x5s,t1_crs4ied,208,"bullshit. imagine if we applied that same level of scrutiny to everything every op posted. i don't see a bunch of people in this thread saying ""i don't think you're actually a programmer."" or ""i don't think you actually have a job."" nobody is offering ""i don't think your colleague actually said that to you."" nobody is spouting up with ""i don't think you're actually a girl.""  threads like these would be incomprehensible. they'd be entirely useless. so we don't do that, not even here where there are accusations that the op is unreliable. for some reason, there's only one part of the op's post where people treat the op as an unreliable narrator: the one where she perceives that some of the treatment she's receiving is because she's female. never mind that there's really well documented evidence that women in tech are [given more critical feedback, and the nature of that feedback is more personally critical](http://fortune.com/2014/08/26/performance-review-gender-bias/). ""those documented issues with sexism in the tech universe can't possibly be part of the cause of you being treated poorly op,"" say reddit's infinitely wise developers, ""i don't know you or anyone you work with, but i'm going to diagnose your illness as not really an illness because i'm a dude on the internet, so i know what's best in your life.""  i mean, shit, this thread is part of the problem, and the glaring blindness to that fact by the people participating in it is further evidence of the issue.",negative
crrsp2m,t1_crrr9y8,208,true.,positive
crs446a,t1_crs2yyu,208,"my conclusion was logical. i don't think you can disagree that op's perceptions are influenced by what other people say.   i agree that how you look influences how you are treated but the extent can be debated. if you wear a yellow instead of a red shirt, that can also change people's perceptions.   it is also a very nuanced topic. a stereotype can be an advantage in one category but a disadvantage in another. asians get less respect on the basketball court than blacks but blacks are perceived as less competent in the work place.   your anecdotes are really just anecdotes and there's not much to say about them unless you want to go into detail so we can debate whether or not they were actually gender related.  and on the last paragraph: they usually don't complain about it. there's a bunch of threads asking whether or not their self-educated background matters. and people don't complain about those threads because it is an open debate.   the actual cause of op's problems is relevant in the same way figuring out whether the cause of symptoms is cancer or a cold is relevant.",negative
crsg2v1,t1_crs44qx,208,"again, that has nothing to do with my point.  here it is again for your reference:  you have to be really careful about how you do something faster or correct someone, because people will see it as a threat. for instance, i'm correcting you right now and you don't like it very much, do you?  this isn't even a gender thing or a programming thing, this happens in every line of work any time you are working with people.    if you disagree with that fundamental point, then please present your argument.  if not, then thank you for the conversation and please don't bother my inbox again.  i am not interested in discussions over what ""order of magnitude"" means or other attempts to distract from my point.",negative
