id,parent_id,comms_num,body,sentiment
d55z2qb,t3_4s2idd,35,"every company will be different.  where i work we attempt to be gender-blind. that doesn't mean there isn't still some inherent bias in how we perceive the same traits, but we have a technical bar and if a candidate is over it, we make an offer.",positive
d560tvi,t3_4s2idd,35,"how are women treated in terms of hiring decisions for internships and jobs in your company?  we try our best to keep the technical bar exactly the same, and we try to be aware of unconscious bias.   do they really have an ""advantage"" due to being less represented?  i think most companies try to keep the actual hiring decision equal, but women and underrepresented people do tend to have an advantage in the recruiting pipeline. some big companies specifically seek out underrepresented people and have programs or scholarships for them ([apple](https://techcrunch.com/2015/04/15/to-promote-diversity-apple-increases-the-number-of-wwdc-scholarships/), [facebook](https://techcrunch.com/2016/04/11/facebooks-using-f8-proceeds-to-fund-dev-bootcamp-scholarships-for-underrepresented-people-in-tech/), [google](https://www.google.com/edu/resources/programs/google-rise-awards/)).   have you heard/seen others consider them to be less capable? is gender not taken into consideration at all, or are they treated differently in any way, and if so, how?  i have not personally heard anyone claim someone is less capable explicitly due to gender, but that doesn't count for unconscious bias, where (for example) one interviewer might consistently mark women as poor communicators without realizing the reason. many big companies try to be aware of this too, by doing things like studying the [pay gap between genders](http://mashable.com/2016/04/11/facebook-microsoft-gender-pay-gap/#xrgc4ca82kqk).",positive
d567r1x,t3_4s2idd,35,"from what i've seen: more likely to get the initial interview/screen but have to meet the normal bar for the interviews.  once hired the primary difference is that women get a female mentor right away and encouraged to go to the grace hopper conference + given the time for it. guys are told to find their own mentor and we can attend conferences as long as we work on the weekend/use vacation to do it. the conference thing isn't a big deal, but it stands out in my mind as the biggest difference because i had a really awkward conversation with a coworker because she didn't realize that we aren't encouraged/given time to attend conferences.",positive
d56ccf7,t3_4s2idd,35,"i've had one interviewer act completely inappropriately before (yeah, definitely because of my gender), and in several of my interviews they were really weird about women but in sort of the awkward but trying way (if i had a dollar for every tech guy that said ""the females"" instead of ""women"", i probably wouldn't work in tech anymore...) i mean the second thing isn't back-breaking or anything, but it's still unfortunate that tech people are that socially inept.  i did have one guy during a phone screen (one of the big 4 btw) basically treat me like an idiot. he didn't accept my answer even though it was a correct variation on the expected answer, and the proceeded to explain what internet advertising is. like he asked if i knew about what the company did with internet advertising and i said no expecting to hear more intricate technical details. he literally answers with something like ""an ad is where to get something who visits the webpage to purchase a product"". -__- he could just be a total jerk was in general, might not have been gender bias. yeah i pretty much never want to work at that company anyway, but that really pushed me away.",negative
d561hdu,t3_4s2idd,35,"here's how i approach hiring:   if i interview three women and one man for the same job, i'm not going to hire one of the women just to make up numbers if the man is going to be the better worker; i'll hire the best *person* for the role. if all three women out-perform the man, then he's out the door and i'll have to choose from the remaining candidates.   i really don't care what gender, race, or sexual orientation someone is, as long as they're a good worker and a good fit for the team.",positive
d5605sj,t3_4s2idd,35,"i think the answer is the same as to many 'how is person-type xxx treated' question:  some companies might be more lenient because they want to hire more person-type xxx. your interviewer might have a (unconcious) bias against person-type xxx, as such it will be harder for you to impress them. some companies might do their best to make sure that the hiring commitees know nothing about your race/gender/religion/etc. in order to make an objective decision where your set of traits plays no role.   as far as female in particular goes, i've heard of examples/suspicions about all three of these possibilities, so your best bet would be to try and narrow down your question to a set of companies, where perhaps people could comment more specifically.",positive
d56hf94,t3_4s2idd,35,"do they really have an ""advantage"" due to being less represented?  based on hear-say, some companies have gender hiring quotas, so yes.  some companies just don't care as long as you pass the interview.  as for work-place sexism, it will always exist but it's not overt and you'd be really unlucky to suffer from it.  oh, one more thing. this will get me downvoted but my skin is thick: be prepared to be stereotyped as being more fit for repetitive tasks. there's obvious pidgeoling for women in testing jobs. rightly so? i just don't know. but i know women that have demanding development jobs and do better compared to most guys. so in the end it's up to you.",positive
d563qjn,t3_4s2idd,35,"at my company, yes, it seems women are mostly hired for the reasons you mentioned. i was talking to one of my teammates who is a girl and mentioned i got asked fizzbuzz in the interview and mentioned the truck is to know the %5 and %3 and she said she said she just had no idea how to do it and gave up. she further told me she knew none of the technical questions asked. she regularly tells me she has no idea why or how she got hired.",negative
d56013z,t3_4s2idd,35,"i think the primarily difference between men and women in the interview stage is that women are more likely to be affected by unconscious bias of the interviewers. example: [simply implementing blind auditions caused the number of females in top orchestras to jump from below 5% to 30%](http://www.theguardian.com/women-in-leadership/2013/oct/14/blind-auditions-orchestras-gender-bias). this kind of unconscious bias tends to manifest itself in tech the same way it [manifests itself in science](http://blogs.scientificamerican.com/unofficial-prognosis/study-shows-gender-bias-in-science-is-real-heres-why-it-matters/).   same thing applies to ethnic minorities. that said it's not all doom and gloom. people are becoming more aware of these things.  in general just be at your best, research interviews, and you should be fine.",negative
d56axdv,t3_4s2idd,35,"when i was interviewed at all my previous jobs, i was always asked illegal questions. of course this is anecdotal, but it happened every time. one was very specific about my plans for starting a family and if i had a partner/boyfriend. another asked a lot of questions about my medical status, as well as the same questions above. after i was hired at the second job,i was chastised for not disclosing my need for accommodation under the americans with disabilities act, despite all the laws in place trying to prevent this from happening. i believe my accommodations are the reason i was chosen to be laid off when i had more experience (both professional and having the most degrees) than the rest of my department. i hope you don't have to deal with this, but be prepared. there are good reasons why there are laws against this in the hiring process, people actively try to elicit that information from you.",negative
d56cudb,t3_4s2idd,35,"at work, the only difference women get in terms of recruiting and new hires is that:  * women will in general be guaranteed to be interviewed by at least one female interviewer, possibly more. * women interns will generally get a female advisor.",positive
d56t9k1,t3_4s2idd,35,i interview and have for about ten years now.   the only thing i care about is ability.  gender does not matter to me. in the work place i don't even see it. the same is true for race.,negative
d560fzj,t3_4s2idd,35,"definitely culture specific, some companies hire more girls because they get government kickbacks from it.",negative
d562gs2,t3_4s2idd,35,"do they really have an ""advantage"" due to being less represented?  i think at some companies that are trying to meet some diversity ration that yes they is a small advantage.  i would think in situations where a guy and girl are both qualified but there is only one spot.  for me personally i don't really care as i will always hire who i feel is the best person for the job.  i never look at gender or race as a deciding factor.  if that means i end up with a company that has 99% asian/white males and 1% female/other races then so be it.  it not because i discriminated it was just none of them were qualified.",positive
d567vxp,t3_4s2idd,35,"i've always really questioned gender bias in several ways in the interviewing process.  this is a fairly relevant and super fascinating finding that, when voices are masked in interviewing so the interviewer can't decipher gender, there is basically no sign that this has any impact on typical interview results by gender:  http://blog.interviewing.io/we-built-voice-modulation-to-mask-gender-in-technical-interviews-heres-what-happened/  now, this isn't to say that women are treated equitably, but i was surprised by the results.   the findings also strongly suggest that the thing that women struggle with most is bouncing back from not doing very well.",positive
d56ezth,t3_4s2idd,35,"there is a bias in your favor. because of the under representation there is a big push for more women in the industry. my first job was in a .net shop where a women who worked there for 5 years did not even have visual studio installed on her machine... i later realized that even though she was a ""developer"" she kind of just decided it wasn't for her and made infographics and powerpoint presentations for other people in the office..............   i know you don't want to be like her. don't be complacent in just being the token women for an office and don't accept a job in a place like that. there are many companies that respect women, and there are some that only hire them to show how ""diverse"" they are. maybe i am jaded, but that is what i have observed.",negative
d56j9f2,t3_4s2idd,35,the standards for employment are lower and they're given preferential treatment (such as higher pay) because there are so few females in the it sector.,negative
d56udby,t1_d561hdu,35,"everyone goes in with that intention, but make sure you're aware of things [like this](http://blogs.scientificamerican.com/unofficial-prognosis/study-shows-gender-bias-in-science-is-real-heres-why-it-matters/) though. we're a lot more susceptible to unconscious bias than we think, but as the name implies it's not a conscious thing.",negative
d56pzp9,t1_d563qjn,35,...so you're saying she can't write even super basic code? what do you do where you work?,negative
d566f8v,t1_d56013z,35,"yeah, for tech interviews, not really.  http://blog.interviewing.io/we-built-voice-modulation-to-mask-gender-in-technical-interviews-heres-what-happened/  tl;dr: women performed no better even when their voices were modulated to conceal their gender.",negative
d56u8bd,t1_d567vxp,35,"that study is very small, and it never changed the genders and names on the resumes.",negative
d56ua2u,t1_d56ezth,35,"there is a bias in your favor.  not really. you have to understand that's in ""exchange"" for being disadvantaged to begin with. it's been shown time and time again that evenly qualified women are less likely to be picked over evenly qualified men.",negative
d56uag8,t1_d56j9f2,35,both of these things are false.,negative
d56sxwr,t1_d56pzp9,35,"yeah, she struggles with very simple concepts. full stack .net developer.",negative
d568h73,t1_d566f8v,35,didn't see this before posting below! this was so crazy interesting!,positive
d56u655,t1_d566f8v,35,tl;dr: women performed no better even when their voices were modulated to conceal their gender.  voice changing is not realistic and is easy to see through. secondly this study never changed the genders and names on the resumes.,negative
d56v2qq,t1_d56ua2u,35,evenly qualified women are less likely to be picked over evenly qualified men.  give me a source that says this is true in the field of computer science.,negative
d56utjl,t1_d56sxwr,35,"huh. if their hiring bar is this low, sounds like it might be time to find a new job.",positive
d56ttpv,t1_d56sxwr,35,"my company is similar. lot of women put in management to meet quotas. my manager is manahing a project with a backend in java and javascript front end. she does not know the difference between the two.  also, it is a data warehouse project. no capacity planning was done. i was given 8gb of space on a server when we needed 500gb. i told my manager we were pulling 700mb of data every day. we would use up the capacity soon. i got a blank stare. realized she did not know what the difference between megabytes and gigabytes were.   bonus points. she does not know what ram and disk space are.",negative
d568wbo,t1_d568h73,35,"it's definitely interesting. it's not an end all, be all study, since i'm not sure if you can gauge someone's gender by the way they talk, rather than just pitch alone. there could still be some confounding factors.  following studies like this, i do think the systemic bias against women in tech is completely overblown. the only case that i think systemic bias exists is when an interviewer knows a women has a child, but this should never be known or brought up during the interview process.",negative
d579wud,t1_d56u655,35,"the interviewer never sees the resume, their name or anything else... it's a blind hire... also, you can see a demonstration of the voice modulation. i don't think you can tell the difference based on pitch alone...  way to ignore all the facts provided... the only unconscious bias that exists here is your bias in thinking that men have an unconscious bias against women.",negative
d56uu7v,t1_d56ttpv,35,"this doesn't really sound like a ""women in management"" thing, but rather incompetent non-technical managers *who happen to be women*.",negative
d56yhdf,t1_d56uu7v,35,i am absolutely not saying that this is a women in management thing. i am pointing out that just pushing people into roles because of some race or gender quotas is the issue.,negative
d5749tb,t1_d56yhdf,35,"how do you know she was there because of a gender quota? if they had hired a man to fill her role, he could have been an equally poor manager.",negative
d574pqp,t1_d5749tb,35,my company has very agressive diversity policies. it is a big part of the company culture.,negative
d6k1x2g,t3_4y0xr2,6,"some companies that recruit on campus will give in person interviews if you are a strong candidate. some even fly intern candidates out for onsite interviews, such as microsoft and palantir. but for the most part, a majority of companies just interview over the phone or skype for internships.",positive
d6k5fj6,t3_4y0xr2,6,"my 4 internship interviews have been at most three rounds consisting of:   * the ""check if you can interact with humans"" phone interview with a recruiter  * the technical phone interview with an engineer giving you a problem on hackerrank  * the final in-person interview on a whiteboard or on a laptop (more often it's the laptop)",positive
d6k3brx,t1_d6k308o,6,"it would be a little weird, but i do know a friend who bypassed the microsoft onsite interviews and just did a series of phone interviews because he had scheduling conflicts.",positive
d6k3c9a,t1_d6k308o,6,"yeah that would probably be a little strange. i would not sweat it really. internships are not to get work out of you, but to basically watch you for a couple months and see if you would be a good full time employee. i highly doubt anyone would care if you are pregnant during the time.",positive
d8tzbcl,t3_57nzno,31,"from my personal experience, i feel like it is usually easier for us to get interviews (between grace hopper and the university career fairs i've been overwhelmed, to say the least), but not easier to get a job over our male peers (i'd say it's been the same difficulty since at the end of the day companies need to make sure we can all code).   most importantly, i think it is way more difficult to keep a girl in those positions. i know that i will not be applying to certain companies simply because i know that they have a toxic culture for women. i also don't want to work in silicon valley because i know i would be living in bro-grammer world there. it's hard for a lot of women to find a place where they can be happy and successful in this field.",negative
d8thoit,t3_57nzno,31,"this is a touchy subject. i don't think the interviews are easier for women, but they do get an easier time getting interviews. there is a pretty large effort within sf to do diversity hiring, which includes any races not traditionally represented (hispanic, african american, etc) as well as females. while they don't discriminate on the interview, they do reach out more proactively to those underrepresented groups.  we had a guest speaker on diversity inclusion that writes for techcrunch give a talk on this. quite a few big companies in sf are doing this.",positive
d8u3zxl,t3_57nzno,31,"imo with an objective robotic personality it's easier to get a job as a girl because you're more sought after. but there is a whole bunch of demotivating nonsense that comes attached so idk how heavy that offset is. i think it likely reaches a point where promotion-wise you are better off as a man. just because basically any opportunity given to a female with have at least some suspicion it was offered based on gender.  i do think getting your first job is easier as a girl in terms of just the mechanics of how the industry works right now. i do not know whether that translates to girls having an easier time getting their first job all things considered, and i am reasonably confident that, if an advantage for women exists at all, there is a tipping point where the advantages shift.  i could be wrong. maybe girls get promoted easy enough all the way. i'm just assuming all the ""she probably only got that cause she's a girl"" comments would eventually catch up and drag you down, regardless of how baseless they may be. nobody wants to promote the person perceived as not deserving their current position and nobody wants to be viewed as the guy promoting based on gender. enough whispering and those are the perceptions that will become prevalent.",negative
d8tx369,t3_57nzno,31,"i think overall it's harder. it's not the technical stuff that's harder though, i mean they get the same interview questions and take the same exams that guys do. it's harder because of the environment they have to go through to get to those interviews. cs is such a male-dominated field and yea it's true that there are outreach programs targeting women and minorities, but imo those don't make it easy for women, they just level the playing field. i believe that someone who thinks those outreach programs give women an overall advantage over men probably doesn't know what it feels like to be a minority. it takes a particularly strong person to spend years working your way through a field where, on top of the already challenging course load, you don't necessarily fit in with your peers and a lot of them are biased against you, whether consciously or unconsciously.    that said, none of that is necessarily specific to women in cs. i imagine guys completing a nursing program have to overcome similar biases, for example",negative
d8tskrp,t3_57nzno,31,"it depends on how strong the woman's stomach is. i know some women that got really turned off by the bro-y male dominated atmosphere (getting asked out/propositioned during interviews, having their teammates rate the attractiveness of women candidates, having coworkers drunkely feel them up at company happy hours, etc.) that they stopped participating and left for a different field or stopped working.   other women aren't bothered as much or are better at compartmentalizing and processing it.",negative
d8tv2ne,t3_57nzno,31,"it's hard to say.  there doesn't appear to be any disparity between the general proportion of women cs majors compared with the proportion of women working for large tech companies (the proportion at google is 17%, which is very close to the current percentage of female cs majors).",positive
d8w1j0b,t3_57nzno,31,"in my experience (female software engineer here), it's not more difficult to get the job, it more difficult to find career advancement once you are in the job. the types of career advancement that comes to a lot of women is more soft skilled oriented and not always technically oriented.",negative
d8ulxuk,t1_d8tzbcl,31,"i also don't want to work in silicon valley because i know i would be living in bro-grammer world there. it's hard for a lot of women to find a place where they can be happy and successful in this field.   i worked in silicon valley, for google, and don't understand the 'brogrammer' thing at all. from what i've read, that's more of a thing in the sf startup world than sv big tech companies.",positive
d8wlf0l,t1_d8tzbcl,31,"just curious (you can pm me if you don't want to post it here), but which companies do you believe have a toxic culture for women? would love to know for future reference. i'm in college right now but will be applying for full-time positions next year.  thanks!",positive
d8tm51u,t1_d8thoit,31,"what methods do they use? do they actively seek them out, or just more likely to give an interview if they see a girl's name on a resume sent to them?",positive
d8tt4vw,t1_d8tskrp,31,jesus christ. they must have worked with some shitty people,negative
d8tu5hg,t1_d8tskrp,31,i'd feel turned off by people like that even if i'm a dude..... i imagine https://xkcd.com/1176/,negative
d8tvtd3,t1_d8tskrp,31,where do you work that any of those aren't a severe hr violation and a half?,negative
d8u3x4z,t1_d8tx6zc,31,"i'm a white female cs student and though i've never felt at a disadvantage in a class, i'm definitely an outlier. on the rare occasion there are other girls in my classes, they always barely speak english.   i'm not saying that's bad and i'm very impressed they are not only learning english, but learning how to *program* in english.",positive
d8ufvfz,t1_d8tx6zc,31,"the whole social upringing/nerdy stereotype is so important imo. i was first interested in programming in grade 8, so i went to programming camp. i also wanted to be popular at school and i read a lot of teen magazines that told me how to look pretty and get boys and that nothing else matters. when i went to the camp it was full of nerds and i figured if i wanted to be cool, i couldn't enjoy this. now that i'm 20 and looking back, this is *really* stupid. but thats how i was conditioned and that's where my priorities were when i was young and trying with fitting in. i don't think the lack of women in cs is simply because women aren't interested, but rather the stereotypes make it unwelcoming when girls are young. even though women like karlie kloss get a lot of hate, i think that it's amazing for showing young girls that you can code and still be ""cool"", and i absolutely would have done that when i was young.",negative
d8wljtd,t1_d8ulxuk,31,"i agree, it definitely varies per company, even within startups.  i interned at a startup in the bay area two years ago, and even though i was one of three female interns (out of ~20 interns and ~150 mostly male employees), i didn't feel the ""brogrammer"" culture at all.",positive
d8tmxaz,t1_d8tm51u,31,hosting women who code and other meetups geared towards underrepresented groups in tech. also doing more oncampus recruiting events at universities that have higher percentages of these groups + targeting those clubs on the college campuses.  these are good ways to get people to apply to the company directly and get them into the system for interviews.,positive
d8ujmu1,t1_d8tm51u,31,"i read somewhere that facebook had a point system when hiring minorities, so a minority hire is worth double a white/asian male hire. despite this obviously making it easier for minorities to get interviews, overall minority numbers only increased by 1% since they started it, so they sure didn't lower the bar.",positive
