id,parent_id,comms_num,body,sentiment
cvo9zzo,t1_cvo8r7x,113,it's true at the big 4 where i'm at where this is a highly measured metric. discrimination against women is no joke and it's monitored.,positive
cvocwft,t1_cvoa58w,113,"on an unrelated note, can we please stop pretending that posting links to news articles instead of primary sources is a valid citation?  as opposed to your complete lack of sources?  you are doing her a serious disservice pretending that everything is fine as long as you negotiate.",negative
cvnt75r,t1_cvnp3q0,113,"i came here to say exactly this. i'm a guy who has job hopped around and had 5 jobs at 4 different companies within a 6 year period and i've almost doubled my salary in that time.   i have worked with women who have been exceptional developers and never seen anyone treat them differently to the guys in the office, however i know i now get paid a good deal more than one of them because she has stayed in the same job for 10-15 years and doesn't want to go look elsewhere.",positive
cvqehfa,t1_cvnp3q0,113,"i was going to write something similar, i'm glad i stopped to actually read the thread first! i'm a female web developer (asp.net/c#) and i have always job hopped. in my 16 year career, i've had 12 jobs and i've made six figures for the past 2 years. currently, i actually make above market rate for a technical architect in my city. there is no glass ceiling as long as you don't see one :)",positive
cvohehd,t1_cvobo30,113,"top tech & financial companies generally have offices in silicon valley and across ca, seattle, new york, boston, salt lake city, chicago, austin and research triangle in north carolina.  ms/google and the likes don't have engineering offices in florida unfortunately as far as i know. you can always try for 3 months internship at ms or google or companies in san fran.",positive
cvnwz9c,t1_cvnwhov,113,"oh this guy was great. i went in knowing nothing about investing and he gave me this amazing eli5 lesson with stick figures and everything.  i really don't want to think about investing. in my mind my retirement account is just another savings account. money goes in there from my paycheck and i don't get taxed on it, cool.  but yeah i'll probably up my contributions to 15% or 20% in two or three years because taxes eat a lot of money.",negative
cvod248,t1_cvobpuy,113,"that was the implication i was going for as i hastily wrote this on the toilet this morning. if you are this concerned about it, i recommend you petition a mod and have it edited yourself, or kindly remove the stick from your ass.",negative
cvod6z3,t1_cvo6y98,113,"that's an absurd expectation. the fantasy land you live in is where white people aren't called white and black people aren't called black. go home troll, you're drink.",negative
cvo377l,t1_cvo2siq,113,"i wasn't using an anecdote, i was talking general cases. perhaps you'd like me to reiterate that - i don't think a woman will be hired with a higher salary purely by virtue of her being a woman. i can admit i may have been weak in declaring that before.   but no, gender discrimination is not illegal regardless of which gender it's in favor of. that's wrong. women are given priority in hiring though affirmative action where a company isn't filling a quota.",negative
cvnshpy,t1_cvnrqwm,113,"maybe in the orchestra's many didn't know, but these days the information is there and you can see there's no difference between male and female employees in this profession, so i don't think that's the same situation.",negative
cvodxq0,t1_cvocwft,113,you didn't even read the studies. if you did you'd know they don't say what you think they do. go actually read the literature and get back to me.  primary sources only.,negative
cvnx0iy,t1_cvnwz9c,113,"i really don't want to think about investing. in my mind my retirement account is just another savings account. money goes in there from my paycheck and i don't get taxed on it, cool.  word to the wise, this is an extremely common and dangerous attitude and you will regret it one day. successful investing is extraordinarily simple. if you can develop software, you can invest effectively in less than 5 minutes per year (i am not exaggerating). just do yourself a favor and learn it. financial literacy makes almost everything in life so much easier. you got lucky and picked vanguard, but most of the financial firms out there make a living on basically skimming money from the accounts of people who don't want to think about investing.",negative
cvodi6u,t1_cvod248,113,"it doesn't matter what implication you're going for if that implication doesn't get across. you're sharing your thoughts on the internet, i assume you expect your intent to be understood by other people or there is no point in making a post.   you would think a software engineer would be able to understand logic and how to communicate that logic, instead of getting defensive. might want to work on that, it'll help your career.",negative
cvoha3y,t1_cvo377l,113,"seriously, down voted for asking for a source?  fine.  let's see what five minutes on google can do...   from [the us department of labor](http://www.dol.gov/ofccp/regs/compliance/aa.htm), ""the regulations at 41 cfr 60-2.12(e), 60-2.30 and 60-2.15, **specifically prohibit quota** and preferential hiring and promotions under the guise of affirmative action numerical goals. in other words, discrimination in the selection decision is prohibited.""  further explanation from [nc state](http://oied.ncsu.edu/equity/affirmative-action-in-employment/), ""affirmative action in employment involves active recruitment of women and minorities by looking for candidates beyond informal job networks traditionally dominated by white men. affirmative action encourages the public advertisement of jobs to identify qualified candidates in places where employers might not otherwise look. in good faith efforts, companies often set goals to diversify their work force by a certain date, which encourage managers to make concerted efforts to cast a wide net in favor of qualified minorities or women. although such measures are **often confused with __quotas,_** these __goals and timetables_ do not mandate the hiring or promotion of a specific number of minority or female candidates. **quotas are not legal,** not tolerable, and are not affirmative action.""  lots of impressive research and critical thinking going on in this sub. /s",negative
cvo3aqc,t1_cvo377l,113,that's wrong. women are given priority in hiring though affirmative action where a company isn't filling a quota.  got any kind of credible source on that statement?,negative
cvntb9c,t1_cvnshpy,113,"what do you mean when you say that the information is there?  judging the quality of a developer is a notoriously difficult task.  plenty of room for bias, even among those who intellectually feel that women are on par with men.",negative
cvo96ib,t1_cvnyoe8,113,"you don't have to become a mercenary but keep in mind that in order for you to **choose** to stay, you need the ability to leave.  picking between offers is a choice. saying you're happy where you are and never entertaining applying elsewhere is rationalizing fear.",negative
cvnx5c8,t1_cvnx0iy,113,"how is that dangerous?   what i mean by ""it's just another savings account"" is that i don't care what's happening to the stock market. i got an index fund because they do better than active trading over the long term. why should i have to think about what's happening to my retirement savings?  it's not like i think i can dip in to my retirement savings whenever i want a new tv.",negative
cvohtch,t1_cvoha3y,113,"i actually got busy today and wasn't able to respond until now. to address your concerns about citation - i'm not sure why you were down voted, but i can say that rather than suggesting someone else back up their claim, it's customary to present your own first. that said, thank you for looking this up.   so a quota isn't legal. perhaps i was playing fast and loose saying that. i take responsibility and admit that there aren't institutionalized numbers of women that have to be hired.   but now i ask you, aside from semantics, what's the difference between a ""quota"" and ""set(ting) goals to diversify their work force by a certain date""?   i mean, at the end of the day companies who are doing this are still actively trying to hire more women (or minorities). inevitably, this will create a potential or bias in favor of these candidates. it's not strictly a quota, you're right, but it still has the same base effect i was talking about.   and don't insult ""research and critical thinking."" until this, you presented no research either. and unless we both agree on something, you don't have any more room to criticize my critical thinking than i do yours.",positive
cvo9msk,t1_cvntb9c,113,you can judge demographics though.,positive
cvnxvqj,t1_cvnx5c8,113,"how is that dangerous?  because you are easy to trick into doing stupid things. the smarter you are, the easier you are to trick.   why should i have to think about what's happening to my retirement savings?  because if you don't, bad things can happen. look at what people did in 2000 and 2008. they didn't think about their retirement savings until it was too late, and then they did stupid things out of emotion. those people will unfortunately never recover. i knew a guy who was invested almost 100% in tech stocks in the last 90s. he'll probably be working at 70 because unfortunately, he didn't really learn his lesson after that.",negative
cvoau7r,t1_cvo9msk,113,"what sort of demographics do you mean?  anyhow, say the hiring manger is completely convinced by demographics that women are every bit as good in cs.  accepting that intellectually doesn't rid us of underlying bias.  the obstacle here isn't some misogynist who just hates women, it is a reasonable person's unreasonable expectations.",negative
cvnyrb2,t1_cvnxvqj,113,i'm doing the opposite of that so i think i'll be fine.,positive
cvobdpz,t1_cvoau7r,113,"it's a thought experiment. if what you're saying is true, a smart manager would ignore his 'subliminal' bias, and just hire only women. then he would make a killing (do you buy the 77% figure?) paying his employees 23% less, while getting the same quality code.  by demographics i just mean it's generally accepted that women aren't worse than men at stem, and if what you're saying is true, a smart manager would know that.",negative
cvo1f9z,t1_cvnyrb2,113,are you? good luck with that. i've seen this movie before.,negative
cvp4a60,t1_cvobdpz,113,"the problem is that hiring isn't done on the macro scale, it is done on the micro scale.  the hiring manager doesn't hire a gender, the hiring manager has to decide on an individual basis.    hiring whoever of a particular gender walks in is probably not a good strategy, regardless of how undervalued that gender might be.  unless you feel that computer scientists are essentially equal and interchangeable, individually.  a smart orchestra hiring manager might intellectually accept that women are just as fit to play instruments as men, that they are underrepresented and underappreciated in orchestra.  that same manager is still going to hire more women in a blind audition than would otherwise.  the obstacle to women in orchestra was not intellectual bigots, it was lower expectations for women.  so unless there is some distinction i'm not understanding, your thought experiment doesn't speak against the possibility that the same thing is happening in cs.",negative
cvp6ull,t1_cvp4a60,113,"you're missing my point. don't accept every woman who walks in, just draw your interviewees from a pool of only women. same quality employees, lower cost.",negative
cvpcavt,t1_cvp6ull,113,"now that's a technique that could actually work, if one expects that women in cs are undervalued.  main problem is that the cost reduction would have to overcome the significantly reduced talent pool, you are losing like 4/5ths of potential employees.  i'm not sure that the benefits outweigh the costs there, i'm skeptical that such a hiring manager would benefit even if women are only being paid 7/10ths.",negative
cvx68ux,t3_3ogr1p,14,i work in a small tech group that has a high proportion of women. three of them have been pregnant and taken maternity leave in the last 3-4 years. i don't know when they revealed they were pregnant -- some of them might have waited until pretty late. they continued working until close to birth and then took about 3 months off.,positive
cvxpwpt,t3_3ogr1p,14,"i think it's just like anything other time you plan to take a lot of time off. wait until your plans are 'for sure', and work with your boss to best handle it. plan with project scope in mind or whatever it takes so that you don't take on a bunch of tasks and leave everyone high and dry.   be realistic about everything. your body needs time to heal and your baby needs extra care and attention. some people may insist you need little time because they know someone who popped a kid out and was doing yoga later in the day (women do this as much, if not more than men in my experience btw, so don't think that it only exists with male bosses). if they are mistaken, be firm in assuring them of your medical needs.   and at the same time, be realistic about returning. some people let their mentality at work be only about the baby for way too long (ie, every day for months claiming they need to leave early to ""help the wife/husband with the baby"") when really they just have grown accustomed to have a scapegoat. not at all saying you'd do this, but i've had several professional friends who let their careers take a big hit because they acted like that and no one around them wanted to be an evil baby hater.   and of course - make sure to keep it all positive. this is your family, and this is what life's all about.",positive
cvxcokd,t3_3ogr1p,14,"not a woman, but i've had women coworkers in medical device companies where you needed to tell hr immediately: when working with x-rays/ct and even mris they have a pretty hefty cya policy in place due to potential complications and differences in exposure limits.  as far as guys taking leave: it varies greatly on a company-to-company basis in the usa.  when my first son was born i took close to 5 weeks combined between vacation and parental leave.  the parental leave was new at the company at the time. i can't say for certain, but my taking it may have contributed to my inclusion in a following layoff.  for my second i've taken about 2 weeks so far- one week vacation, one week unpaid leave. i'm still in my first year at the company so fmla doesn't apply and i don't have much vacation accrued.",negative
cvxubuq,t3_3ogr1p,14,"not me. my coworker is an awesome mom and extremely well planned.  she worked full time until her first, took maternity leave, then switched to part time upon returning.  on the days she works her kids stay with grandparents or go to daycare. this way she keeps coding, can ""stay sane"", and be involved with raising her kids.  a lot has to do with employer selection and she made sure she found an arrangement that worked for her family.  she announced to the whole team after the doctors had confirmed ""perfectly healthy baby -gender-""",positive
cvx8ogn,t3_3ogr1p,14,"i wanted to take my whole 3 weeks of vacation after my oldest daughter (now 3) was born to spend time with her and my wife.  i mentioned this to my manager who has two girls of his own (teenagers).  the conversation went something like this: ""i see you put in for all 3 weeks.  you can take them if you want but trust me only take a week, you'll be ready to come back after that i assure you.""  i took his advice..he was right. :)  my wife is on her feet at work and she was working right up until the end of both pregnancies.",positive
cvxp8b9,t1_cvx1pwe,14,"from what i've been told it's awkward to be like, ""i'm pregnant!"" and then two weeks later to be like, ""i'm not :("".  lord knows it, the last time something like that happened at the office the poor girl had a bubble of repulsion around her for a month, no one wanted to be the first to talk to the woman who just lost a baby.",negative
cvy3jyg,t1_cvxcjyg,14,"i have two kids (one and three), 5 nephews (all 2 and under) and one niece (six months old) so i know there's no way you'd be expected to go back after a week, or even 6.  i was only saying my manager had the ""take as long as you need"" attitude, but immediately crossed over into advising just to help. :)  i encourage most women to take as long as they need.  my wife got 8 weeks (c-section both times) but took closer to the full 13 for fmla.  and that still wasn't really enough time, but she went back anyway.  by about 12 weeks she was getting there.",positive
cvxh1h2,t1_cvxcjyg,14,"if a male manager thinks i'll only need a week of leave after having a baby i'd like to see him push a cantaloupe out of his ass and tell me how he feels after.  i do think this would be a problem for new parents of all genders though. newborn infants can't be babysat, they can't be left at daycare. i'm not even sure how soon i'd trust my own mom with my newborn baby.  i don't see why part-time hours can't be an option though. something about exempt employee law or something?  i won't pretend to know what it's like to be a new parent but i doubt it'd be feasible to work from home with a new baby.",negative
cvy3m2o,t1_cvxh1h2,14,"i won't pretend to know what it's like to be a new parent but i doubt it'd be feasible to work from home with a new baby.  easier than it seems.  they sleep a lot.  and even if they aren't sleeping they are just kinda hanging around.  it's far more challenging to work from home with a 1 year old who is all over the place constanty and never stops.  i do it at least once a week, but my wifi button on the laptop has been pushed more than once by a tiny hand. :)",positive
cvxcbjr,t1_cvxbgfp,14,"even the small companies i worked for kept women on during maternity leave. if they had fired a woman for pregnancy, i'd be looking for a better company as well.",positive
cwhs7kj,t3_3qruym,14,"do you guys think it'll be hard for me to get a job out of school because of my background?  with the amount of resources many big companies are putting into encouraging minorities to study computer science, i wouldn't be surprised if you're background helps you.   of course, what really mattes is your ability. however, all else equal, a company would rather have a minority candidate because increasing diversity in tech is a pretty big issue at the moment.   point being, study hard and you'll have no problems finding work. the world needs more good software developers",positive
cwhwrx4,t3_3qruym,14,"despite the constant noise that minorities are something companies are trying to keep, companies will not cut slack in terms of engineering quality when it comes to candidates - regardless of minority status. just remember that.",negative
cwhstpr,t3_3qruym,14,"lol, quite the opposite, i think it will be easier for you to get the job because of your background.",positive
cwht7i9,t3_3qruym,14,"while there are initiatives for hiring diverse candidates, it still doesn't counter the ingrained bias people have.  ""all things (skills) being equal"" would great, but they aren't perceived to be equal.  the exact same qualifications are rated differently based on gender and/or race.  the sad truth of it is that you will have to be better than the majority around you because of this.  work hard and do what you can with the rest.",negative
cwhsqdi,t3_3qruym,14,"where i work there is a big emphasis on diversity, both in terms of ethnicity and gender. so while there is still an imbalance overall that is something many companies are actively trying to change. overall i don't think it will be a problem. so if it is something you want to do then go for it!",positive
cwi9l6v,t3_3qruym,14,"definitely not, if anything it'll work in your favor. many companies like to diversify their employee demographic, for example, google has this program called step where they usually only let females and minorities intern (you tick both boxes).",positive
cwhsv77,t3_3qruym,14,"i think the only thing that could hold you back is your own effort or ability. like many have said, diversity is good.  ba instead of a bs might hurt a little too, depending on the program.",positive
cwht5q1,t1_cwhs7kj,14,"sorry but the whole thing of being a minority helping you is a falacy. it's harder but as long as you have the drive, you will be ok.  i am a minority too and been there numerous times.",negative
cwhvdpg,t1_cwhs7kj,14,"imo, this is just a feel-good message that people and companies propagate. some people have engrained biases. people with biases and reservations about someone who isn't like them will likely not call someone for an interview because of their name. as i minority i realize this, so i try to study/work twice as hard as others. its hard to understand the situation if you are not affected.",negative
cwibp4w,t1_cwhvdpg,14,that's just not true.,negative
cwidui7,t1_cwibp4w,14,"this is just my opinion. i know that everyone is not like that, however, there are a lot of people who will not want to call someone for an interview  because of their name. i'm sure you have read the about the harvard study on racial names so i don't need to refer to it. that being said, i personally haven't had a had time finding a job here in canada while still studying. my name sounds really african cos i'm originally from nigeria.",negative
cwifefn,t1_cwidui7,14,"i guess i'm biased because from my observations, i'm seeing that minorities are getting jobs much more easily than non-minorities.   i went to a small engineering school and out of my major's graduating class (ee/compe), every single girl was able to get a job regardless of her gpa.   whereas i have a bunch of guy friends who still haven't been able to find jobs which is 5 months after graduating.",negative
cwihb02,t1_cwifefn,14,"you have a valid reason believe taut minorities are getting jobs. i totally agree with you, however, i am aware that there are some people who will not want to hire someone who is a visible minority or call someone with a name that sounds strange. can i add you as a friend here? i intend to start a small study using my internship application. i'll give you updates of my finding",positive
cwihfpr,t1_cwihb02,14,"sure, go for it!",positive
czmlx7s,t3_441bwh,10,"have you been involved with any local user groups / meetups up to this point? consistently attending a few of them is a good way to network. there are groups like pyladies, rails girls, and women who code in many cities as well, but i wouldn't limit myself to them (though it's certainly nice to have some contact with them, because great advice for job hunting / career type stuff! ...and the occasional commiseration). my local wwc has a slack, and that's how i know those folks, never been to one of their in-person meetups.",positive
czmn9v1,t3_441bwh,10,"well as a female programmer, you're going to have an easier time getting interviews, so take advantage of that and really study up for those interviews. if you ace the interviews you get, you're going to get job offers left and right since you're female.   once in the work place, don't try and get special treatment, nothing pisses off fellow coworkers more than someone getting special treatment.",positive
czmlv3f,t3_441bwh,10,"as specifically a female programmer? outside of what you can do as any programmer, there are some female engineering conferences and company info sessions you can attend.",positive
czmt2r3,t1_czmo7q7,10,"eh, i don't think of linkedin groups as being anything more than a badge on your profile. i know some of them have some discussion, but i really prefer irc/slack interactions rather than those boards. my first irc channel was linuxchix.  my negative experiences regarding being a woman in this industry have all been related to things like conferences and open source, not in the workplace. but then, attending and speaking at conferences is good for your career, so gotta do that. from when i was new to now i have definitely changed my attitude about it (18 year old me ""what? feminism? that's like, 70s stuff, it's all fixed now!""), but even leaving aside negative experiences, it can just plain be helpful to discuss career stuff, real time, in a not-google-able place (ie, not here). that can range from negotiation advice to ""oh yeah, i've heard of them...they don't pay well,"" to yesterday i learned that for a *lot* of companies it's ""unless it says you have to be in the office, this position can be remote"" whereas i always assumed it was ""unless it says remote is available, you have to be in the office."" and yeah, a lot of that'll be the same for men and women, but sometimes women need a little more encouragement to negotiate, to overcome impostor syndrome, etc.",positive
czmv1md,t1_czmu1m1,10,"your local in-person groups probably have mailing lists, so i'd get on those and start participating. finding time to show up to some in-person ones will really help with future job-hunting, though, because you want to have a bunch of people who can all say ""oh yeah, i've seen her around. from conversations i've been in with her, she really knows her stuff!""  i find a lot of the tech reading i do comes from links found on twitter. i do interact with some local programmers (people who are part of my local groups) on twitter too.",positive
czof4bu,t1_czmnt57,10,"don't listen to him, he's sexist and has no idea what he's talking about.",negative
