id,parent_id,comms_num,body,sentiment
cqx8qab,t3_34qp31,11,"it probably depends on where you work, but if the place is otherwise casual, i would say those dresses are not too short.  i've worked mostly for bay area companies, you would have been fine with those at any company i was at.",positive
cqxdw4n,t3_34qp31,11,"business casual. also i think the dress looks a bit short on that woman, but it isn't that big a deal",positive
cqxe240,t3_34qp31,11,"i'm in a similar situation - a girl working in a very casually-dressed intern role and at uni.  i tend to try to cover up when i go from uni to work, and not wear anything that stands out.  i don't think i have to do that, i just feel like it's easier to fit in when i dress in a t shirt and jeans.  i worry about looking too young/girly and not being taken seriously.  plus, it's super comfy!",positive
cqxhu5v,t3_34qp31,11,"believe it or not, this is something men worry about, too.  i wore a suit and tie to an interview, saw that everyone was in jeans and polos so i put the jacket and tie in the car at my first break.  the best bet is to wear what others are wearing unless it's distracting.  that's what i do.",positive
cqxt1gc,t3_34qp31,11,"do you know if the company has any official policy on what people should wear? if not and everyone else is just wearing casual style clothing, then i'd say what you're wearing is fine.   otherwise do you interact at all with other people from other companies? if you do, or know there are times you will be, then that might be a time to wear something smarter. as obviously not all companies share the same mindset about work attire as your company does.   but then again i'm probably the wrong person to be commenting on this entirely. as i think dress code in the workplace shouldn't matter/should be left up to the worker. and i mean my own attire is awful compared to others, shoes and jeans that are literally falling apart.",negative
cqz055q,t3_34qp31,11,if they only just reach your legs they are probably too short for work,negative
cqxl6fz,t1_cqxdw4n,11,the attire at an engineering centric company is rarely business casual.,positive
cqximt6,t1_cqxg1xd,11,"i wouldn't see anything wrong with the attire in the picture. nothing about it screams ""don't hire me"".",positive
cqxlmcv,t1_cqxg1xd,11,i don't see anything wrong with what you're wearing and i've seen plenty of devs wear similar length skirts. i would wear shorts a little longer than that at work and no one said anything so unless your work is much more strict than mine (which it doesn't seem like) i think you're fine. maybe switch in jeans for when you have meetings with higher ups if you're uncomfortable,positive
cqxlm7g,t1_cqxl6fz,11,i agree but i was talking about the the attire for an interview. if that were the case then i'd show up in shorts and a t shirt like a regular workday.,positive
cr1xvts,t3_35865w,53,"i'm concerned ... the gut reaction will be ""ah, amish people, they don't computer!"" or ""hmm religious, bad culture fit.""  i'd like to tell you you're wrong, but i'm pretty sure you're not. people will try and be understanding and accepting but subconsciously something about you will seem off, and they'll be less inclined to want to hire you. this is based on my experience in silicon valley where showing up to a job interview in a suit is often worse than showing up in jeans. there are, of course, exceptions, most notably muslim women in headscarfs, but even those women are usually interviewing for a specific set of positions with a specific demographic of applicants.  i'd love to say silicon valley is blind to race, culture, and religion, but it's not. people definitely get sorted into companies, roles, and teams based on these things, even if not intentionally, and at both big and small companies.  i could easily wrote a whole post on race and culture in the silicon valley tech industry.",negative
cr2kl53,t3_35865w,53,"i would not wear it to an interview, as long as you are personally comfortable with that. the reason is: this is your chance to make a very first impression. you don't want *anything* you can control getting in the way of making the best first impression you can and, honestly, the best first impression is probably going to be looking as ""normal"" as possible. (i say normal in quotes because while obviously nothing is wrong with wearing a head-covering, it's just less expected than usual.)   i liken a situation like this to asking for vacation or special treatment early in the interview process. sure, sometimes you need to say things like, ""one month after my start date, i have a two-week family vacation i need to go on"" or ""i need to leave early every monday to take my kid to soccer"", but you don't usually mention them on the first interview. you usually wait until you've accepted the offer, because you don't want anything to get in the way of them loving you and offering you the position. in the end, you wearing a head-covering at work will be no issue (at any reasonable company), but you don't want anything stopping you from getting in the door.",negative
cr1y0bz,t3_35865w,53,"do you want to work somewhere that wouldn't hire you because you wore your covering in an interview?  i understand that finding jobs isn't always easy or fun, but i would see this as a way for you to filter out employers you'd rather not work for.  bias exists everywhere, saying anything otherwise is idealistic mumbo jumbo.  but i'm confident that there are organizations out there that couldn't care less what you wear to work as long as you work.",positive
cr21tc1,t3_35865w,53,i sense a good ama here.,positive
cr2bdsk,t3_35865w,53,"might i suggest a scarf or a more stylish cap on top of your head covering as a compromise? r/femalefashion advice might have some ideas.   at the end of the day there maybe people who discriminate, but there will be plenty of people who could care less so long as you can code and hopefully the later will out weigh the former.",positive
cr25mcv,t3_35865w,53,"you might want to consider a government job, if there are any available in your area and it's something you have interest in.  in my experience, they've been more open to diversity than other employers.",positive
cr2ncdw,t3_35865w,53,"i would totally leave that off during job interviews.  it is tough enough being a woman, no need to advertise that you are into one of the more extreme religions.   wear it once you start your job and have a chance to show what you can do.",positive
cr25i9a,t3_35865w,53,"honestly you'll probably have more trouble with the fact that you're a woman than with anything you wear (that's not limited to computing - there are idiots in every field).   as long as you're comfortable answering if someone asks, i don't think it will be a problem otherwise, again outside of people that probably wouldn't have hired you anyway.   edit: this was not intended to say women can't program, this was intended to say there are a lot of misogynists in programming.",positive
cr2gbsq,t3_35865w,53,for me and a lot of people like me we dont care about your religion. what we do care about is an attire that matches the job. if i were a manager i would not like someone wearing a baseball cap to work. this is no different.,negative
cr2hmqh,t3_35865w,53,"you say that they may think you're ""not a culture fit"". do you think that there may be any validity to this assumption? blatant religiosity can be very off-putting to some people.",negative
cr1y3ke,t1_cr1xvts,53,this post hit everything spot on. yes you will be judged.,negative
cr2qzox,t1_cr2kl53,53,"i would say this is probably the most correct answer. most employers will not have an issue with this after the fact, but the first impression does matter. if you don't see this fist impression as binding for the rest of the time you're there, you could leave the cap at home for the interview and if you get the job, reintroduce it a week after you start. what are they going to do then? ""oh this cap is too funny, better fire her?"" if they do, you don't want to work there anyways.",positive
cr3de6q,t1_cr2kl53,53,"yeah the head covering is a distraction. either you don't tell the interviewer what it means and they notice it and wonder why you'd wear something so weird to an interview (at least i would), or you tell them what it means and set them up for a discrimination lawsuit.  the head covering is like a wedding ring (at least for women), it's personal information that the interviewer doesn't need or want when making a decision about your potential employment at the company. leave it off while you're in the building and put it back on when you leave.",negative
cr28s2w,t1_cr1y0bz,53,maybe you get one bad interviewer whose views don't align with the general views of the company or its employees.,negative
cr87ut6,t1_cr1y0bz,53,"do you want to work somewhere that wouldn't hire you because you wore your covering in an interview?  when the vast majority of interviewers would have a subconscious bias against her head covering, it is something she just has to get over. she is really shooting herself in the foot by wearing it and only looking for employers that don't judge.",negative
cr2l0pl,t1_cr2gbsq,53,"clarification for those apparently not getting what i mean: religion an religious outings have no place in a workplace. so why would a headdress like this be any different then a baseball cap, which is not appreciated in a buisness attire as well? what makes this different?",negative
cr2i8dp,t1_cr1y3ke,53,every day. about everything. by everyone. for the rest of your life.,negative
cr20vuz,t1_cr20hry,53,depends on where in the east coast. there are plenty of startups on the east coast with a sv culture.,positive
cr2gbv2,t1_cr28s2w,53,if one bad interviewer has the power to veto a strong candidate based on personal bias then there is still a major flaw in how the company operates.,negative
cr23s75,t1_cr21wim,53,"because religious dress is uncommon in tech?  that was my question for you:  is your choice of dress due to religion or personal style?   honestly, if you're interviewing at a larger, national/international company, it probably won't be an issue.  at smaller shops, where personal views aren't as cracked down upon by hr, it might be a hindrance or a benefit, depending on the person doing the interviewing/hiring.  in most cases though, your personality will be the deciding aspect.... if you're withdrawn/shy during the interview, they might think ""this is going to be too awkward"".  if you're friendly and outgoing, your individuality might be seen as a benefit.  aside from your dress, are there any other ""quirks""?     edit:   there was a weird sense of relief for me when i got a new coworker who wears a yarmulka and tzitzit.   oh.... orthodox jew?  bah, that's nothing.",positive
cr223at,t1_cr21wim,53,"because religious dress is uncommon in tech?  i wouldn't know.   i just find the issue interesting generally. i often wear things which identify me as being jewish, but i've never done so at work. partly because i've worked mainly in gov settings, but also because i'm not observant to the degree where i would do that anyway.  i see a fair amount of women dressed in the manner you described in my geographical area, but i've never seen them in a workplace setting.   maybe just tell potential employers you're part of a community of mennonites in mexico who are fighting against the drug cartels.",positive
cr2nfrh,t1_cr2i8ms,53,"i would disagree with the above advice, if only because a scarf over the head has the same connotation as any head covering, so you may as well wear the real thing if you are going to.    there is no head covering for professional women that would look not-religious in some way.",negative
cr2pu5r,t1_cr2l0pl,53,"exactly what she said. how the fuck are you guys so dense you don't understand the difference between religious headwear and a fucking baseball cap? she isn't trying to convert you. the fact that you even feel the need to police what she wears to the workplace indicates are very, very narrow view point when it comes to tolerance of others.   people like you are why we have laws protecting her right to wear religious attire which in no way hinders her ability to work or distracts others.",negative
cr2zcp7,t1_cr2l0pl,53,"why would a headdress like this be any different then a baseball cap, which is not appreciated in a buisness attire as well? what makes this different?  legal protection.",negative
cr2lono,t1_cr2936w,53,i wish you were wrong. there is some part that still thinks that the only way a culture like this might change is by stalwartly wearing what she's comfortable in - but it is clear that it would come a great personal cost. its really up to her to decide what's more important: advancing her professional career or making a statement.,negative
cr5v7tr,t1_cr5iy93,53,basically yeah. which wouldn't be an issue if men took paternity leave at the same rate that women take maternity leave.,negative
cr2ij2h,t1_cr2gbv2,53,suppose you have leeway to do poorly on one interview and still pass.  you do poorly on one and then okay on another but you get marked as poorly on that one too because your interviewer had a bias against you for what you wore.,positive
cr74e5c,t1_cr2mt58,53,lol at people downvoting you for stating the truth.,negative
cr2y5pl,t1_cr2pu5r,53,"i never said she wants to convert anyone. and how are a baseball cap, a high hat, a woolen cap and this thing any different? i never said she can't be religious in any way.",negative
cr2zhl8,t1_cr2zcp7,53,where you are maybe yes. but in essence being religious makes you no better then anyone else.,negative
cr2eeta,t1_cr251m1,53,"i grew up with quakers on both sides of my family. i never realized there were more conservative quakers that wear this until today. i guess you learn something new everyday!   anyhow, i just want to say that your place of work is going to have to accept you for who you are. if you are going to being wearing a head covering everyday, you might as well wear it in your interview. if they aren't going to be accepting of your beliefs, you won't be happy there in the long run.   mind you, i saw this as an agnostic/atheist who actively hides his beliefs from his muslim colleagues (and some of his christian colleagues) for fear of being a target for being fired. but hey, they pay me well so i just suck it up and consider it like a tax i pay for working in a conservative muslim country with no taxes.",positive
cr22akf,t1_cr227he,53,solidarity.,positive
cr2yard,t1_cr2y5pl,53,"and how are a baseball cap, a high hat, a woolen cap and this thing any different?  the meaning behind them?  lol at looking them as the same just because they cover your head. that would be superficial.",negative
cr32qa7,t1_cr2zhl8,53,"even without getting into religious or legal reasons, work-appropriate attire is subjective and at the management's discretion. what might work for a young web startup won't be appropriate for another. also, some types of headwear can be more dignified than others, just like dress slacks are more dignified than jogging pants.",negative
cr2yg1a,t1_cr2yard,53,"why is the meaning different? you explained it yourself. and not superficial, the fact that having a certain hobby should mean you have more rights then another person is superficial. like i said. no issues with religion, but it is just another hobby.",negative
cr34fhq,t1_cr32qa7,53,"exactly this. it does not fit business attire in a lot of situations, for example at banks where ties and suits are still norm. id rather go to work in my jeans and shirt as well but it does not suit the occasion.",negative
cr2zdi1,t1_cr2nxrr,53,"honestly, i don't think it's really going to be an issue.  as long as you're personable, friendly (approachable), and have the requisite skills, the religious dress will just come across as a quick thought of ""oh, that's neat"" in the mind of the interviewer, and then pass on to relevant topics.",positive
cr2yroj,t1_cr2yg1a,53,"why is the meaning different?  this should be easy for you to tell. baseball caps aren't religious.  also, previously you said this:  we dont care about your religion  that statement can become difficult to defend once you start disallowing some religious articles of clothing because it is against some dress code. now suddenly you have to choose between respecting one's religion or upholding the dress code.  no issues with religion, but it is just another hobby.  religion is a hobby? lol wut  edit: /u/macoafi has the clearest answer. you'd be breaking us law if your dress policy doesn't make religious clothing exempt.",negative
cr2zk8d,t1_cr2yroj,53,and this kind of law is exactly what is wrong in a country like the us. giving someone additional rights because they think differently. looks a lot like discrimination to me.,negative
cr2yzwn,t1_cr2yroj,53,"yes it is. nothing more nothing less. it is something you have interest in and possibly share with others. it does not make you better or worse a person, it has no benefits to the general public whatsoever and it is something you do in your free time. thinking any other and thinking you should have more or less rights then someone else because you think something made up is real and should guide you in your life choices is the scariest thing i can imagine. it shows no respect to another human being whatsoever and is pretentious as fuck.",negative
csrjr3k,t1_cr2zk8d,53,"there are no ""additional rights"". everyone is a protected class in the us. regardless of what god(s) you believe in, or if you believe in no god, those beliefs are protected, and no company can discriminate you based on them.  besides, you are on the career questions sub, and all advice given here must be within the context of what is legally allowed, and not based on what you believe the laws should be.",negative
cr2z6l2,t1_cr2yzwn,53,"thinking any other and thinking you should have more or less rights then someone else because you think something made up is real and should guide you in your life choices is the scariest thing i can imagine.  if you as an employer don't want to make accommodations of an employee's religious practices, you'd have to contest the civil rights act.",negative
cr2zbvq,t1_cr2z6l2,53,never said that. and we dont need an act like that because we are rational beings i hope. unfortunately history says otherwise. even nowadays...,negative
cr2zhty,t1_cr2zbvq,53,"never said that.  said what?  we dont need an act like that  as long as it exists, though, you still gotta follow the law, for your own benefit. however at this point, i'm starting to doubt you are in the us so different laws may apply to you.",negative
cr2v8wi,t3_35bgeo,18,"it will make it harder in any field, software development is no exception.",negative
cr2xwwz,t3_35bgeo,18,"as long as you outwardly present as one or the other of the traditional (binary) genders and don't make a big deal of it unless anyone asks, i expect you'll be fine.   you might have a hard time if you typically dress as what a good friend of mine, who is trans, would type as ""mixed"", e.g., wearing heels and pearls with a traditional men's suit, or wearing a dress with face stubble. most of the country just doesn't have the experience being around people like you and like my friend to really be able to, well, grok it and go about their daily lives.   zhe sometimes has a really hard time with more traditional people, but generally presents as male (and looks very neutral without any makeup) and so has an easier time in work environments and so on.  mainly, as long as it isn't brought up, it should be a non-issue. gender (and sexuality) are really more part of your personal life than your work life, i think.",positive
cr2xgrp,t3_35bgeo,18,"it probably depends more on the company. as a whole i'd say the software engineering industry is generally more progressive in this regard. but it'll probably make more of a difference (if at all) at a conservative long-standing non-technical business that employs software engineers compared to newer tech companies or start ups.  personally i've only had experience working at the same place (not the same team) as transgendered people and non-heterosexual sexualities (that i know of). it didn't seem to be a big deal. there was a homosexual guy on a closely related team and the only reason i knew his orientation was because he had mentioned something about his boyfriend in casual conversation.   oh ya, and i forgot that the director of my division is a homosexual woman. again, i only know that because she referred to her wife once, so it really doesn't seem like that big of a deal.",positive
cr3uy1e,t3_35bgeo,18,i think the replies in this topic are actually a pretty good example of the hostility and ignorance you can expect to encounter. but don't let that stop you - there are legal protections and there are companies with progressive cultures that would welcome you. it just may take longer to find a place worth staying at.,negative
cr3cyl3,t3_35bgeo,18,"at my last internship it was a super diverse and welcoming environment. female ceo, female head of engineering, female qa manager, several female developers, and a transgender woman on the technical support staff. i'm not sure how long the support woman had been presenting as female but i heard nothing but positive comments about the quality of her work. nobody screwed up her pronouns, nobody brought up her transgender status. overall the company felt very gender-balanced.  my team lead was also a black french speaker from africa, my qa lead was middle eastern, and the software engineering manager was latino. it was nice not feeling like i was on some prime-time tv series surrounded by white men. the diversity felt realistic and comfortable for me, since my high school was super diverse.  i got lucky at that company but i think as ethnic diversity and gender/sexuality diversity gain importance and visibility, more companies will start to look like the company i worked at.",positive
cr2t6a6,t3_35bgeo,18,what does your orientation have to do with computer science or programming? or how well you do your job? when is it even going to come up?,negative
cr2u63j,t3_35bgeo,18,no one cares as long as you're a good developer.,positive
cr351p8,t3_35bgeo,18,why do you need to present your gender at all? it's not something other people really care about.,negative
cr3f7uk,t3_35bgeo,18,"it may be awkward at stodgy government-contractor type companies like lockheed martin (or maybe not, i don't know), but who wants to work there anyways? it will be a rounding error at silicon valley area companies like google/apple/facebook/yahoo!, etc., or most startups in the area.  i knew a guy at apple who sported a full beard and wore a dress every day. i also had the privilege to work with a woman who is universally recognized as one of the foremost authorities in her field of software, and who happens to be trans.  you will go as far as your technical ability can take you!",positive
cr33bf5,t1_cr2v8wi,18,"while that's certainly true let's be totally frank: in the field of software engineering most advocate and believe in a, ""don't ask, don't tell"" policy. contrary to outward appearance of *startup culture* its still as much of an old boys club as the enterprise half of the coin.",negative
cr2tm78,t1_cr2t6a6,18,"i read the question more like: are team members and hiring managers known to be more on the open minded side. i don't know about the us, but in europe as far as i encountered it, yes. first: developers and more so security related positions don't have dress codes even if they have contact with clients (only on summits or conferences) and if your talent also sets you apart you can get away with all kinds of being unique.",positive
cr2ug7u,t1_cr2u63j,18,"and if you don't go around making a big deal out of it at every opportunity (ie: correcting people every time someone uses the ""wrong"" pronoun).",negative
cr380fa,t1_cr2ub4s,18,why would someone in the computer science or programming field need to see your medical records? why should my employers care on my first day of work when the name they know me by does not match my government identification??,negative
cr34wql,t1_cr2wami,18,"generally people are referring to a dog's sex, not its gender identity.",negative
cr2yrtq,t1_cr2wami,18,"some people aren't comfortable around gays, much less transgender individuals.  forcing them to adopt your point of view (that a person can choose their own pronoun) can create a ""difficult"" work environment.    i'm gay myself, and while i'm not closeted at work, i also don't flaunt my sexuality.  it's not a matter of hiding who you are, it's about acting and behaving in a manner appropriate for a workplace.",negative
cr31htl,t1_cr2yrtq,18,"this right here is the actual correct answer in this thread. your gender and sexual orientation shouldn't be a topic of conversation or interaction in the workplace.   anecdotally, i'll say that i consider myself a pretty progressive individual wrt to social issues, but if i had to work with someone who says things i could post to /r/tumblrinaction, i would go crazy.",negative
cr3difd,t1_cr3cihh,18,"i see your point, and agree with it. spouses\dating get brought up at work. i don't see that as a problem, that's just chit-chat. if someone isn't interested\is bothered, they can just avoid that non-work related conversation.",positive
